{
  "$schema": "https://json-schema.org/draft/2020-12/schema",
  "$id": "https://scenescape.intel.com/tracker/schema/config.schema.json",
  "title": "Tracker Service Configuration",
  "description": "Main configuration file for Tracker Service.",
  "type": "object",
  "required": ["infrastructure", "scenes"],
  "examples": [
    {
      "infrastructure": {
        "mqtt": {
          "host": "manager.scenescape.intel.com",
          "port": 8883,
          "tls": {
            "ca_cert_path": "/run/secrets/ca-cert",
            "client_cert_path": "/run/secrets/client-cert",
            "client_key_path": "/run/secrets/client-key"
          }
        },
        "manager": {
          "url": "https://manager.scenescape.intel.com",
          "auth_path": "/run/secrets/manager.auth"
        }
      }
    },
    {
      "infrastructure": {
        "mqtt": {
          "host": "localhost",
          "port": 1883,
          "insecure": true
        }
      },
      "scenes": {
        "source": "file",
        "file_path": "scenes.json"
      }
    }
  ],
  "properties": {
    "infrastructure": {
      "type": "object",
      "description": "External service connections",
      "required": ["mqtt"],
      "properties": {
        "mqtt": {
          "type": "object",
          "description": "MQTT broker connection settings",
          "required": ["host", "port"],
          "properties": {
            "host": {
              "type": "string",
              "description": "Broker hostname or IP address"
            },
            "port": {
              "type": "integer",
              "description": "Broker port (typically 1883 for TCP, 8883 for TLS)"
            },
            "insecure": {
              "type": "boolean",
              "description": "Disable TLS for unencrypted connections (development only)",
              "default": false
            },
            "tls": {
              "type": "object",
              "description": "TLS certificate settings for secure connections",
              "properties": {
                "ca_cert_path": {
                  "type": "string",
                  "description": "Path to CA certificate file"
                },
                "client_cert_path": {
                  "type": "string",
                  "description": "Path to client certificate file"
                },
                "client_key_path": {
                  "type": "string",
                  "description": "Path to client private key file"
                },
                "verify_server": {
                  "type": "boolean",
                  "description": "Verify server certificate",
                  "default": true
                }
              }
            }
          }
        },
        "manager": {
          "type": "object",
          "description": "Manager REST API connection for fetching scene configurations. Required when scenes.source is 'api'.",
          "properties": {
            "url": {
              "type": "string",
              "description": "Manager API base URL"
            },
            "auth_path": {
              "type": "string",
              "description": "Path to JSON auth file containing user and password keys"
            },
            "ca_cert_path": {
              "type": "string",
              "description": "Path to CA certificate for HTTPS verification."
            }
          },
          "required": ["url", "auth_path"]
        },
        "ntp": {
          "type": "object",
          "description": "NTP server connection for clock offset correction.",
          "properties": {
            "server": {
              "type": "string",
              "description": "NTP server hostname or IP (e.g. 'pool.ntp.org'). When set, the tracker periodically queries this server to correct for local clock drift before evaluating message lag. Leave empty or omit to rely on the OS clock discipline (chronyd/ntpd)."
            },
            "sync_interval_s": {
              "type": "integer",
              "description": "How often to re-synchronize the NTP offset in seconds.",
              "default": 300,
              "minimum": 60
            }
          }
        },
        "otlp": {
          "type": "object",
          "description": "OpenTelemetry collector connection (shared by metrics and tracing). Note: Secure (TLS) connections are not yet supported.",
          "properties": {
            "endpoint": {
              "type": "string",
              "description": "OTLP gRPC endpoint (e.g., localhost:4317)"
            },
            "insecure": {
              "type": "boolean",
              "description": "Use insecure (non-TLS) connection. Must be true (secure not yet supported).",
              "default": true
            }
          },
          "required": ["endpoint"]
        },
        "tracker": {
          "type": "object",
          "description": "Tracker service internal settings",
          "properties": {
            "healthcheck": {
              "type": "object",
              "description": "HTTP healthcheck server settings for Kubernetes probes",
              "properties": {
                "port": {
                  "type": "integer",
                  "description": "Port for healthcheck HTTP server (/healthz, /readyz endpoints)",
                  "default": 8080,
                  "minimum": 1024,
                  "maximum": 65535
                }
              }
            },
            "schema_validation": {
              "type": "boolean",
              "description": "Enable JSON schema validation for incoming and outgoing MQTT messages. Disable for performance in production if profiling shows message parsing is a bottleneck.",
              "default": true
            }
          }
        }
      }
    },
    "observability": {
      "type": "object",
      "description": "Logging and telemetry settings",
      "properties": {
        "logging": {
          "type": "object",
          "description": "Logging configuration",
          "properties": {
            "level": {
              "type": "string",
              "description": "Log level",
              "enum": ["trace", "debug", "info", "warning", "error"],
              "default": "info"
            }
          }
        },
        "metrics": {
          "type": "object",
          "description": "OpenTelemetry metrics export settings. Requires infrastructure.otlp to be configured.",
          "properties": {
            "enabled": {
              "type": "boolean",
              "description": "Enable OpenTelemetry metrics export",
              "default": false
            },
            "export_interval_s": {
              "type": "integer",
              "description": "Metrics export interval in seconds",
              "default": 60,
              "minimum": 1
            }
          }
        },
        "tracing": {
          "type": "object",
          "description": "OpenTelemetry distributed tracing settings. Requires infrastructure.otlp to be configured.",
          "properties": {
            "enabled": {
              "type": "boolean",
              "description": "Enable OpenTelemetry distributed tracing",
              "default": false
            },
            "export_interval_s": {
              "type": "integer",
              "description": "Batch span processor schedule delay in seconds",
              "default": 5,
              "minimum": 1
            }
          }
        }
      }
    },
    "tracking": {
      "type": "object",
      "description": "Tracking algorithm parameters",
      "properties": {
        "max_lag_s": {
          "type": "number",
          "description": "Maximum lag allowed for MQTT detection frames in seconds. Frames arriving with greater lag will be dropped.",
          "default": 1.0,
          "minimum": 0
        },
        "max_unreliable_time_s": {
          "type": "number",
          "description": "Time in seconds before a track becomes reliable and is published. Filters out spurious detections.",
          "default": 1.0,
          "minimum": 0
        },
        "non_measurement_time_dynamic_s": {
          "type": "number",
          "description": "Time in seconds before deleting a track for a dynamic (moving) object that stopped receiving measurements.",
          "default": 0.8,
          "minimum": 0
        },
        "non_measurement_time_static_s": {
          "type": "number",
          "description": "Time in seconds before deleting a track for a static object that stopped receiving measurements.",
          "default": 1.6,
          "minimum": 0
        },
        "time_chunking_rate_fps": {
          "type": "integer",
          "description": "Rate at which the tracker processes batched detections from all cameras. Higher values reduce latency but increase CPU usage.",
          "default": 15,
          "minimum": 1,
          "maximum": 60
        },
        "max_workers": {
          "type": "integer",
          "description": "DoS protection: maximum worker threads (one per scene+category). Limits resource exhaustion from unexpected categories.",
          "default": 50,
          "minimum": 1
        }
      }
    },
    "scenes": {
      "type": "object",
      "description": "Scene configuration source. Use 'api' (default) to fetch scenes dynamically from Manager REST API (requires infrastructure.manager). Use 'file' to load scenes from an external JSON file.",
      "properties": {
        "source": {
          "type": "string",
          "description": "Configuration source: file (from JSON file) or api (from Manager REST API)",
          "enum": ["file", "api"],
          "default": "api"
        },
        "file_path": {
          "type": "string",
          "description": "Path to scene definitions JSON file (relative to config file directory or absolute). Required when source=file."
        }
      },
      "if": {
        "properties": {
          "source": {
            "const": "file"
          }
        }
      },
      "then": {
        "required": ["file_path"]
      }
    },
    "ptz": {
      "type": "object",
      "description": "PTZ PoseContext consumption (Positioning service). Both modes are off by default and mutually exclusive. The four bounds are deployment-owned, have no defaults, and are required when either mode is on.",
      "properties": {
        "enabled": {
          "type": "boolean",
          "default": false,
          "description": "Gate PTZ camera detections with the dwell contract and project admitted batches with the per-frame PoseContext. Env: TRACKER_PTZ_ENABLED"
        },
        "shadow_mode": {
          "type": "boolean",
          "default": false,
          "description": "Observe PoseContexts and record decisions without changing tracking. Env: TRACKER_PTZ_SHADOW_MODE"
        },
        "max_pose_age_s": {
          "type": "number",
          "minimum": 0,
          "description": "Maximum local age of the admitting PoseContext in seconds (> 0). Env: TRACKER_PTZ_MAX_POSE_AGE_S"
        },
        "max_clock_offset_s": {
          "type": "number",
          "minimum": 0,
          "description": "Maximum NTP offset in seconds (> 0); PTZ detections are rejected while it is exceeded. Env: TRACKER_PTZ_MAX_CLOCK_OFFSET_S"
        },
        "max_detection_pipeline_latency_s": {
          "type": "number",
          "minimum": 0,
          "description": "Measured hard bound on detection pipeline latency in seconds (> 0); detection age and dwell limit. Env: TRACKER_PTZ_MAX_DETECTION_PIPELINE_LATENCY_S"
        },
        "max_detection_timestamp_uncertainty_s": {
          "type": "number",
          "minimum": 0,
          "description": "Detection acquisition timestamp uncertainty in seconds (>= 0). Env: TRACKER_PTZ_MAX_DETECTION_TIMESTAMP_UNCERTAINTY_S"
        },
        "assignments_path": {
          "type": "string",
          "minLength": 1,
          "default": "/scenescape/config/positioning-assignments.json",
          "description": "Deployment-owned source_id -> resolver_id manifest. Env: TRACKER_PTZ_ASSIGNMENTS_PATH"
        },
        "shadow": {
          "type": "object",
          "description": "Decision logging settings (both modes)",
          "properties": {
            "run_id": {
              "type": "string",
              "pattern": "^[A-Za-z0-9._-]{1,128}$",
              "default": "unspecified",
              "description": "Run identifier joining shadow records into one artifact. Env: TRACKER_PTZ_SHADOW_RUN_ID"
            },
            "sample_every_n": {
              "type": "integer",
              "minimum": 1,
              "default": 10,
              "description": "Record every Nth decision per source plus the first of each distinct decision in that window. Env: TRACKER_PTZ_SHADOW_SAMPLE_EVERY_N"
            },
            "per_decision": {
              "type": "boolean",
              "default": false,
              "description": "Write sampled per-decision JSONL records instead of one summary log line per applied pose. Env: TRACKER_PTZ_SHADOW_PER_DECISION"
            }
          },
          "additionalProperties": false
        }
      },
      "additionalProperties": false
    }
  },
  "additionalProperties": false
}
